{
  "schema": "gentle-ai.review-integration.repair/v1",
  "contract": "gentle-ai.review-integration/v1",
  "operation": "review.repair",
  "mode": "preflight",
  "assessment": {
    "schema": "gentle-ai.review-authority-repair-assessment/v1",
    "status": "eligible",
    "class": "legacy_v1_historical_alias",
    "cause": "unsupported_historical_v1_operation_alias",
    "disposition": "quarantine-approved-historical-alias",
    "repository_binding": "sha256:3333333333333333333333333333333333333333333333333333333333333333",
    "candidate": {
      "lineage_id": "historical-alias",
      "revision": "sha256:1111111111111111111111111111111111111111111111111111111111111111",
      "chain_identity": "sha256:2222222222222222222222222222222222222222222222222222222222222222",
      "event_count": 6,
      "alias_event_count": 2,
      "operations": [
        "review/complete-fix",
        "review/validate-fix"
      ]
    },
    "counts": {
      "lineages": 1,
      "compact_lineages": 0,
      "legacy_lineages": 1,
      "events": 12,
      "bytes": 4096,
      "eligible_candidates": 1,
      "unsupported_lineages": 0,
      "conflicts": 0
    },
    "supported_operations": [
      "review/complete-fix",
      "review/validate-fix"
    ],
    "authorization_schema": "gentle-ai.review-repair-authorization/v1"
  },
  "provider_inputs": {
    "class": "legacy_v1_historical_alias",
    "lineage_id": "historical-alias",
    "expected_revision": "sha256:1111111111111111111111111111111111111111111111111111111111111111",
    "cause": "unsupported_historical_v1_operation_alias",
    "disposition": "quarantine-approved-historical-alias",
    "repository_binding": "sha256:3333333333333333333333333333333333333333333333333333333333333333",
    "authorization_schema": "gentle-ai.review-repair-authorization/v1"
  },
  "required_inputs": [
    "actor",
    "reason",
    "maintainer_authorization"
  ]
}
